{
  "address": "0x749c0F997eE36f0E5843aC4DD9360b22c8F50163",
  "abi": [
    {
      "inputs": [],
      "stateMutability": "nonpayable",
      "type": "constructor"
    },
    {
      "anonymous": false,
      "inputs": [
        {
          "indexed": true,
          "internalType": "address",
          "name": "oldAdmin",
          "type": "address"
        },
        {
          "indexed": true,
          "internalType": "address",
          "name": "newAdmin",
          "type": "address"
        }
      ],
      "name": "NewAdmin",
      "type": "event"
    },
    {
      "anonymous": false,
      "inputs": [
        {
          "indexed": true,
          "internalType": "address",
          "name": "oldImplementation",
          "type": "address"
        },
        {
          "indexed": true,
          "internalType": "address",
          "name": "newImplementation",
          "type": "address"
        }
      ],
      "name": "NewImplementation",
      "type": "event"
    },
    {
      "anonymous": false,
      "inputs": [
        {
          "indexed": true,
          "internalType": "address",
          "name": "oldPendingAdmin",
          "type": "address"
        },
        {
          "indexed": true,
          "internalType": "address",
          "name": "newPendingAdmin",
          "type": "address"
        }
      ],
      "name": "NewPendingAdmin",
      "type": "event"
    },
    {
      "anonymous": false,
      "inputs": [
        {
          "indexed": true,
          "internalType": "address",
          "name": "oldPendingImplementation",
          "type": "address"
        },
        {
          "indexed": true,
          "internalType": "address",
          "name": "newPendingImplementation",
          "type": "address"
        }
      ],
      "name": "NewPendingImplementation",
      "type": "event"
    },
    {
      "stateMutability": "payable",
      "type": "fallback"
    },
    {
      "inputs": [],
      "name": "acceptProxyAdmin",
      "outputs": [
        {
          "internalType": "bool",
          "name": "",
          "type": "bool"
        }
      ],
      "stateMutability": "nonpayable",
      "type": "function"
    },
    {
      "inputs": [],
      "name": "acceptProxyImplementation",
      "outputs": [
        {
          "internalType": "bool",
          "name": "",
          "type": "bool"
        }
      ],
      "stateMutability": "nonpayable",
      "type": "function"
    },
    {
      "inputs": [],
      "name": "pendingProxyAdmin",
      "outputs": [
        {
          "internalType": "address",
          "name": "",
          "type": "address"
        }
      ],
      "stateMutability": "view",
      "type": "function"
    },
    {
      "inputs": [],
      "name": "pendingProxyImplementation",
      "outputs": [
        {
          "internalType": "address",
          "name": "",
          "type": "address"
        }
      ],
      "stateMutability": "view",
      "type": "function"
    },
    {
      "inputs": [],
      "name": "proxyAdmin",
      "outputs": [
        {
          "internalType": "address",
          "name": "",
          "type": "address"
        }
      ],
      "stateMutability": "view",
      "type": "function"
    },
    {
      "inputs": [],
      "name": "proxyImplementation",
      "outputs": [
        {
          "internalType": "address",
          "name": "",
          "type": "address"
        }
      ],
      "stateMutability": "view",
      "type": "function"
    },
    {
      "inputs": [],
      "name": "proxyImplementationVersion",
      "outputs": [
        {
          "internalType": "uint8",
          "name": "",
          "type": "uint8"
        }
      ],
      "stateMutability": "view",
      "type": "function"
    },
    {
      "inputs": [
        {
          "internalType": "address",
          "name": "newPendingAdmin",
          "type": "address"
        }
      ],
      "name": "setPendingProxyAdmin",
      "outputs": [
        {
          "internalType": "bool",
          "name": "",
          "type": "bool"
        }
      ],
      "stateMutability": "nonpayable",
      "type": "function"
    },
    {
      "inputs": [
        {
          "internalType": "address",
          "name": "newPendingImplementation",
          "type": "address"
        }
      ],
      "name": "setPendingProxyImplementation",
      "outputs": [
        {
          "internalType": "bool",
          "name": "",
          "type": "bool"
        }
      ],
      "stateMutability": "nonpayable",
      "type": "function"
    },
    {
      "stateMutability": "payable",
      "type": "receive"
    }
  ],
  "transactionHash": "0x1f7d31ad896b24e23153bb98e60ced2e34038bc7afbc56c547228ddfe40699d5",
  "receipt": {
    "to": "0x4e59b44847b379578588920cA78FbF26c0B4956C",
    "from": "0xa52422BB8c29E4d55243d310fB6BAe793162452e",
    "contractAddress": null,
    "transactionIndex": 3,
    "gasUsed": "688337",
    "logsBloom": "0x00000000000000000000000000000000000000000000000000000000000000000000000000000000000000000000000000000000000000000000000000000000000000000000000000000000000000000000000000000000000000000000000000000000000000000000000000000000000000000000000000000000000000000000000000000000000000000000000000000000000000000000000000000000000000000000000000000000000000000000000000000000000000000000000000000000000000000000000000000000000000000000000000000000000000000000000000000000000000000000000000000000000000000000000000000000",
    "blockHash": "0xf5bf36ac0a7638edac1ba18f7c4e3c5cc1e0455c0ccbb7310c87dde4569cd982",
    "transactionHash": "0x1f7d31ad896b24e23153bb98e60ced2e34038bc7afbc56c547228ddfe40699d5",
    "logs": [],
    "blockNumber": 10726426,
    "cumulativeGasUsed": "1403819",
    "status": 1,
    "byzantium": true
  },
  "args": [],
  "solcInputHash": "7bd3cd4664d8ba9f7b36363d5e3e5aa4",
  "metadata": "{\"compiler\":{\"version\":\"0.8.6+commit.11564f7e\"},\"language\":\"Solidity\",\"output\":{\"abi\":[{\"inputs\":[],\"stateMutability\":\"nonpayable\",\"type\":\"constructor\"},{\"anonymous\":false,\"inputs\":[{\"indexed\":true,\"internalType\":\"address\",\"name\":\"oldAdmin\",\"type\":\"address\"},{\"indexed\":true,\"internalType\":\"address\",\"name\":\"newAdmin\",\"type\":\"address\"}],\"name\":\"NewAdmin\",\"type\":\"event\"},{\"anonymous\":false,\"inputs\":[{\"indexed\":true,\"internalType\":\"address\",\"name\":\"oldImplementation\",\"type\":\"address\"},{\"indexed\":true,\"internalType\":\"address\",\"name\":\"newImplementation\",\"type\":\"address\"}],\"name\":\"NewImplementation\",\"type\":\"event\"},{\"anonymous\":false,\"inputs\":[{\"indexed\":true,\"internalType\":\"address\",\"name\":\"oldPendingAdmin\",\"type\":\"address\"},{\"indexed\":true,\"internalType\":\"address\",\"name\":\"newPendingAdmin\",\"type\":\"address\"}],\"name\":\"NewPendingAdmin\",\"type\":\"event\"},{\"anonymous\":false,\"inputs\":[{\"indexed\":true,\"internalType\":\"address\",\"name\":\"oldPendingImplementation\",\"type\":\"address\"},{\"indexed\":true,\"internalType\":\"address\",\"name\":\"newPendingImplementation\",\"type\":\"address\"}],\"name\":\"NewPendingImplementation\",\"type\":\"event\"},{\"stateMutability\":\"payable\",\"type\":\"fallback\"},{\"inputs\":[],\"name\":\"acceptProxyAdmin\",\"outputs\":[{\"internalType\":\"bool\",\"name\":\"\",\"type\":\"bool\"}],\"stateMutability\":\"nonpayable\",\"type\":\"function\"},{\"inputs\":[],\"name\":\"acceptProxyImplementation\",\"outputs\":[{\"internalType\":\"bool\",\"name\":\"\",\"type\":\"bool\"}],\"stateMutability\":\"nonpayable\",\"type\":\"function\"},{\"inputs\":[],\"name\":\"pendingProxyAdmin\",\"outputs\":[{\"internalType\":\"address\",\"name\":\"\",\"type\":\"address\"}],\"stateMutability\":\"view\",\"type\":\"function\"},{\"inputs\":[],\"name\":\"pendingProxyImplementation\",\"outputs\":[{\"internalType\":\"address\",\"name\":\"\",\"type\":\"address\"}],\"stateMutability\":\"view\",\"type\":\"function\"},{\"inputs\":[],\"name\":\"proxyAdmin\",\"outputs\":[{\"internalType\":\"address\",\"name\":\"\",\"type\":\"address\"}],\"stateMutability\":\"view\",\"type\":\"function\"},{\"inputs\":[],\"name\":\"proxyImplementation\",\"outputs\":[{\"internalType\":\"address\",\"name\":\"\",\"type\":\"address\"}],\"stateMutability\":\"view\",\"type\":\"function\"},{\"inputs\":[],\"name\":\"proxyImplementationVersion\",\"outputs\":[{\"internalType\":\"uint8\",\"name\":\"\",\"type\":\"uint8\"}],\"stateMutability\":\"view\",\"type\":\"function\"},{\"inputs\":[{\"internalType\":\"address\",\"name\":\"newPendingAdmin\",\"type\":\"address\"}],\"name\":\"setPendingProxyAdmin\",\"outputs\":[{\"internalType\":\"bool\",\"name\":\"\",\"type\":\"bool\"}],\"stateMutability\":\"nonpayable\",\"type\":\"function\"},{\"inputs\":[{\"internalType\":\"address\",\"name\":\"newPendingImplementation\",\"type\":\"address\"}],\"name\":\"setPendingProxyImplementation\",\"outputs\":[{\"internalType\":\"bool\",\"name\":\"\",\"type\":\"bool\"}],\"stateMutability\":\"nonpayable\",\"type\":\"function\"},{\"stateMutability\":\"payable\",\"type\":\"receive\"}],\"devdoc\":{\"details\":\"Storage for voting power is at this address, while execution is delegated to the prism proxy implementation contract All contracts that use voting power should reference this contract.\",\"kind\":\"dev\",\"methods\":{\"acceptProxyAdmin()\":{\"details\":\"Admin function for pending admin to accept role and update admin\",\"returns\":{\"_0\":\"boolean indicating success of operation\"}},\"acceptProxyImplementation()\":{\"details\":\"Admin function for new implementation to accept it's role as implementation\",\"returns\":{\"_0\":\"boolean indicating success of operation\"}},\"constructor\":{\"details\":\"Sets initial proxy admin to `msg.sender`\"},\"pendingProxyAdmin()\":{\"returns\":{\"_0\":\"admin address\"}},\"pendingProxyImplementation()\":{\"returns\":{\"_0\":\"pending implementation address\"}},\"proxyAdmin()\":{\"returns\":{\"_0\":\"admin address\"}},\"proxyImplementation()\":{\"returns\":{\"_0\":\"implementation address\"}},\"proxyImplementationVersion()\":{\"returns\":{\"_0\":\"version number\"}},\"setPendingProxyAdmin(address)\":{\"details\":\"Admin function to begin change of admin. The newPendingAdmin must call `acceptAdmin` to finalize the transfer.\",\"params\":{\"newPendingAdmin\":\"New pending admin.\"},\"returns\":{\"_0\":\"boolean indicating success of operation\"}},\"setPendingProxyImplementation(address)\":{\"details\":\"Admin function for proposing new implementation contract\",\"returns\":{\"_0\":\"boolean indicating success of operation\"}}},\"title\":\"VotingPowerPrism\",\"version\":1},\"userdoc\":{\"events\":{\"NewAdmin(address,address)\":{\"notice\":\"Emitted when pendingAdmin is accepted, which means admin is updated\"},\"NewImplementation(address,address)\":{\"notice\":\"Emitted when pendingImplementation is accepted, which means implementation is updated\"},\"NewPendingAdmin(address,address)\":{\"notice\":\"Emitted when pendingAdmin is changed\"},\"NewPendingImplementation(address,address)\":{\"notice\":\"Emitted when pendingImplementation is changed\"}},\"kind\":\"user\",\"methods\":{\"acceptProxyAdmin()\":{\"notice\":\"Accepts transfer of admin rights. msg.sender must be pendingAdmin\"},\"acceptProxyImplementation()\":{\"notice\":\"Accepts new implementation for prism. msg.sender must be pendingImplementation\"},\"constructor\":{\"notice\":\"Construct a new Voting Power Prism Proxy\"},\"pendingProxyAdmin()\":{\"notice\":\"Get pending admin for prism proxy\"},\"pendingProxyImplementation()\":{\"notice\":\"Address of pending implementation contract\"},\"proxyAdmin()\":{\"notice\":\"Get current admin for prism proxy\"},\"proxyImplementation()\":{\"notice\":\"Address of implementation contract\"},\"proxyImplementationVersion()\":{\"notice\":\"Current implementation version for proxy\"},\"setPendingProxyAdmin(address)\":{\"notice\":\"Begins transfer of admin rights. The newPendingAdmin must call `acceptAdmin` to finalize the transfer.\"},\"setPendingProxyImplementation(address)\":{\"notice\":\"Create new pending implementation for prism. msg.sender must be admin\"}},\"version\":1}},\"settings\":{\"compilationTarget\":{\"contracts/VotingPowerPrism.sol\":\"VotingPowerPrism\"},\"evmVersion\":\"berlin\",\"libraries\":{},\"metadata\":{\"bytecodeHash\":\"ipfs\",\"useLiteralContent\":true},\"optimizer\":{\"enabled\":true,\"runs\":999999},\"remappings\":[]},\"sources\":{\"contracts/VotingPowerPrism.sol\":{\"content\":\"// SPDX-License-Identifier: MIT\\npragma solidity ^0.8.0;\\n\\nimport \\\"./lib/PrismProxy.sol\\\";\\n\\n/**\\n * @title VotingPowerPrism\\n * @dev Storage for voting power is at this address, while execution is delegated to the prism proxy implementation contract\\n * All contracts that use voting power should reference this contract.\\n */\\ncontract VotingPowerPrism is PrismProxy {\\n\\n    /**\\n     * @notice Construct a new Voting Power Prism Proxy\\n     * @dev Sets initial proxy admin to `msg.sender`\\n     */\\n    constructor() {\\n        // Initialize storage\\n        ProxyStorage storage s = proxyStorage();\\n        // Set initial proxy admin\\n        s.admin = msg.sender;\\n    }\\n\\n    /**\\n     * @notice Forwards call to implementation contract\\n     */\\n    receive() external payable {\\n        _forwardToImplementation();\\n    }\\n\\n    /**\\n     * @notice Forwards call to implementation contract\\n     */\\n    fallback() external payable {\\n        _forwardToImplementation();\\n    }\\n}\\n\",\"keccak256\":\"0xb8ca196b3a083e5e5e6472ef30f41311e7de8245520ec7f752347793d92b909a\",\"license\":\"MIT\"},\"contracts/lib/PrismProxy.sol\":{\"content\":\"// SPDX-License-Identifier: MIT\\npragma solidity ^0.8.0;\\n\\ncontract PrismProxy {\\n\\n    /// @notice Proxy admin and implementation storage variables\\n    struct ProxyStorage {\\n        // Administrator for this contract\\n        address admin;\\n\\n        // Pending administrator for this contract\\n        address pendingAdmin;\\n\\n        // Active implementation of this contract\\n        address implementation;\\n\\n        // Pending implementation of this contract\\n        address pendingImplementation;\\n\\n        // Implementation version of this contract\\n        uint8 version;\\n    }\\n\\n    /// @dev Position in contract storage where prism ProxyStorage struct will be stored\\n    bytes32 constant PRISM_PROXY_STORAGE_POSITION = keccak256(\\\"prism.proxy.storage\\\");\\n\\n    /// @notice Emitted when pendingImplementation is changed\\n    event NewPendingImplementation(address indexed oldPendingImplementation, address indexed newPendingImplementation);\\n\\n    /// @notice Emitted when pendingImplementation is accepted, which means implementation is updated\\n    event NewImplementation(address indexed oldImplementation, address indexed newImplementation);\\n\\n    /// @notice Emitted when pendingAdmin is changed\\n    event NewPendingAdmin(address indexed oldPendingAdmin, address indexed newPendingAdmin);\\n\\n    /// @notice Emitted when pendingAdmin is accepted, which means admin is updated\\n    event NewAdmin(address indexed oldAdmin, address indexed newAdmin);\\n\\n    /**\\n     * @notice Load proxy storage struct from specified PRISM_PROXY_STORAGE_POSITION\\n     * @return ps ProxyStorage struct\\n     */\\n    function proxyStorage() internal pure returns (ProxyStorage storage ps) {        \\n        bytes32 position = PRISM_PROXY_STORAGE_POSITION;\\n        assembly {\\n            ps.slot := position\\n        }\\n    }\\n\\n    /*** Admin Functions ***/\\n    \\n    /**\\n     * @notice Create new pending implementation for prism. msg.sender must be admin\\n     * @dev Admin function for proposing new implementation contract\\n     * @return boolean indicating success of operation\\n     */\\n    function setPendingProxyImplementation(address newPendingImplementation) public returns (bool) {\\n        ProxyStorage storage s = proxyStorage();\\n        require(msg.sender == s.admin, \\\"Prism::setPendingProxyImp: caller must be admin\\\");\\n\\n        address oldPendingImplementation = s.pendingImplementation;\\n\\n        s.pendingImplementation = newPendingImplementation;\\n\\n        emit NewPendingImplementation(oldPendingImplementation, s.pendingImplementation);\\n\\n        return true;\\n    }\\n\\n    /**\\n     * @notice Accepts new implementation for prism. msg.sender must be pendingImplementation\\n     * @dev Admin function for new implementation to accept it's role as implementation\\n     * @return boolean indicating success of operation\\n     */\\n    function acceptProxyImplementation() public returns (bool) {\\n        ProxyStorage storage s = proxyStorage();\\n        // Check caller is pendingImplementation and pendingImplementation \\u2260 address(0)\\n        require(msg.sender == s.pendingImplementation && s.pendingImplementation != address(0), \\\"Prism::acceptProxyImp: caller must be pending implementation\\\");\\n \\n        // Save current values for inclusion in log\\n        address oldImplementation = s.implementation;\\n        address oldPendingImplementation = s.pendingImplementation;\\n\\n        s.implementation = s.pendingImplementation;\\n\\n        s.pendingImplementation = address(0);\\n        s.version++;\\n\\n        emit NewImplementation(oldImplementation, s.implementation);\\n        emit NewPendingImplementation(oldPendingImplementation, s.pendingImplementation);\\n\\n        return true;\\n    }\\n\\n    /**\\n     * @notice Begins transfer of admin rights. The newPendingAdmin must call `acceptAdmin` to finalize the transfer.\\n     * @dev Admin function to begin change of admin. The newPendingAdmin must call `acceptAdmin` to finalize the transfer.\\n     * @param newPendingAdmin New pending admin.\\n     * @return boolean indicating success of operation\\n     */\\n    function setPendingProxyAdmin(address newPendingAdmin) public returns (bool) {\\n        ProxyStorage storage s = proxyStorage();\\n        // Check caller = admin\\n        require(msg.sender == s.admin, \\\"Prism::setPendingProxyAdmin: caller must be admin\\\");\\n\\n        // Save current value, if any, for inclusion in log\\n        address oldPendingAdmin = s.pendingAdmin;\\n\\n        // Store pendingAdmin with value newPendingAdmin\\n        s.pendingAdmin = newPendingAdmin;\\n\\n        // Emit NewPendingAdmin(oldPendingAdmin, newPendingAdmin)\\n        emit NewPendingAdmin(oldPendingAdmin, newPendingAdmin);\\n\\n        return true;\\n    }\\n\\n    /**\\n     * @notice Accepts transfer of admin rights. msg.sender must be pendingAdmin\\n     * @dev Admin function for pending admin to accept role and update admin\\n     * @return boolean indicating success of operation\\n     */\\n    function acceptProxyAdmin() public returns (bool) {\\n        ProxyStorage storage s = proxyStorage();\\n        // Check caller is pendingAdmin and pendingAdmin \\u2260 address(0)\\n        require(msg.sender == s.pendingAdmin && msg.sender != address(0), \\\"Prism::acceptProxyAdmin: caller must be pending admin\\\");\\n\\n        // Save current values for inclusion in log\\n        address oldAdmin = s.admin;\\n        address oldPendingAdmin = s.pendingAdmin;\\n\\n        // Store admin with value pendingAdmin\\n        s.admin = s.pendingAdmin;\\n\\n        // Clear the pending value\\n        s.pendingAdmin = address(0);\\n\\n        emit NewAdmin(oldAdmin, s.admin);\\n        emit NewPendingAdmin(oldPendingAdmin, s.pendingAdmin);\\n\\n        return true;\\n    }\\n\\n    /**\\n     * @notice Get current admin for prism proxy\\n     * @return admin address\\n     */\\n    function proxyAdmin() public view returns (address) {\\n        ProxyStorage storage s = proxyStorage();\\n        return s.admin;\\n    }\\n\\n    /**\\n     * @notice Get pending admin for prism proxy\\n     * @return admin address\\n     */\\n    function pendingProxyAdmin() public view returns (address) {\\n        ProxyStorage storage s = proxyStorage();\\n        return s.pendingAdmin;\\n    }\\n\\n    /**\\n     * @notice Address of implementation contract\\n     * @return implementation address\\n     */\\n    function proxyImplementation() public view returns (address) {\\n        ProxyStorage storage s = proxyStorage();\\n        return s.implementation;\\n    }\\n\\n    /**\\n     * @notice Address of pending implementation contract\\n     * @return pending implementation address\\n     */\\n    function pendingProxyImplementation() public view returns (address) {\\n        ProxyStorage storage s = proxyStorage();\\n        return s.pendingImplementation;\\n    }\\n\\n    /**\\n     * @notice Current implementation version for proxy\\n     * @return version number\\n     */\\n    function proxyImplementationVersion() public view returns (uint8) {\\n        ProxyStorage storage s = proxyStorage();\\n        return s.version;\\n    }\\n\\n    /**\\n     * @notice Delegates execution to an implementation contract.\\n     * @dev Returns to the external caller whatever the implementation returns or forwards reverts\\n     */\\n    function _forwardToImplementation() internal {\\n        ProxyStorage storage s = proxyStorage();\\n        // delegate all other functions to current implementation\\n        (bool success, ) = s.implementation.delegatecall(msg.data);\\n\\n        assembly {\\n              let free_mem_ptr := mload(0x40)\\n              returndatacopy(free_mem_ptr, 0, returndatasize())\\n\\n              switch success\\n              case 0 { revert(free_mem_ptr, returndatasize()) }\\n              default { return(free_mem_ptr, returndatasize()) }\\n        }\\n    }\\n}\",\"keccak256\":\"0xb1402780eddcac8f334014689fda8be46a274344e4d1c8364c819a861a2a6f0e\",\"license\":\"MIT\"}},\"version\":1}",
  "bytecode": "0x608060405234801561001057600080fd5b5060007f0e44922e752e5aec2c0503d75bafd73ddc558f76127cf1484a1819fd3dfb6b9080546001600160a01b0319163317905550610b1c806100546000396000f3fe60806040526004361061009a5760003560e01c80633e47158c1161006957806394d8fbd01161004e57806394d8fbd0146102565780639c2562db1461026b578063ec10bbd5146102b5576100a9565b80633e47158c146101f75780636405901614610241576100a9565b80630758e714146100b15780630c870f91146100e657806315596a201461015157806325f86cbb146101ad576100a9565b366100a9576100a76102d5565b005b6100a76102d5565b3480156100bd57600080fd5b506100d16100cc366004610a52565b6103a0565b60405190151581526020015b60405180910390f35b3480156100f257600080fd5b507f0e44922e752e5aec2c0503d75bafd73ddc558f76127cf1484a1819fd3dfb6b925473ffffffffffffffffffffffffffffffffffffffff165b60405173ffffffffffffffffffffffffffffffffffffffff90911681526020016100dd565b34801561015d57600080fd5b507f0e44922e752e5aec2c0503d75bafd73ddc558f76127cf1484a1819fd3dfb6b935474010000000000000000000000000000000000000000900460ff1660405160ff90911681526020016100dd565b3480156101b957600080fd5b507f0e44922e752e5aec2c0503d75bafd73ddc558f76127cf1484a1819fd3dfb6b915473ffffffffffffffffffffffffffffffffffffffff1661012c565b34801561020357600080fd5b507f0e44922e752e5aec2c0503d75bafd73ddc558f76127cf1484a1819fd3dfb6b905473ffffffffffffffffffffffffffffffffffffffff1661012c565b34801561024d57600080fd5b506100d16104f1565b34801561026257600080fd5b506100d16106bc565b34801561027757600080fd5b507f0e44922e752e5aec2c0503d75bafd73ddc558f76127cf1484a1819fd3dfb6b935473ffffffffffffffffffffffffffffffffffffffff1661012c565b3480156102c157600080fd5b506100d16102d0366004610a52565b610906565b7f0e44922e752e5aec2c0503d75bafd73ddc558f76127cf1484a1819fd3dfb6b92546040517f0e44922e752e5aec2c0503d75bafd73ddc558f76127cf1484a1819fd3dfb6b909160009173ffffffffffffffffffffffffffffffffffffffff909116906103459083903690610a8f565b600060405180830381855af49150503d8060008114610380576040519150601f19603f3d011682016040523d82523d6000602084013e610385565b606091505b505090506040513d6000823e81801561039c573d82f35b3d82fd5b6000807f0e44922e752e5aec2c0503d75bafd73ddc558f76127cf1484a1819fd3dfb6b90805490915073ffffffffffffffffffffffffffffffffffffffff163314610472576040517f08c379a000000000000000000000000000000000000000000000000000000000815260206004820152602f60248201527f507269736d3a3a73657450656e64696e6750726f7879496d703a2063616c6c6560448201527f72206d7573742062652061646d696e000000000000000000000000000000000060648201526084015b60405180910390fd5b60038101805473ffffffffffffffffffffffffffffffffffffffff8581167fffffffffffffffffffffffff0000000000000000000000000000000000000000831681179093556040519116919082907fe945ccee5d701fc83f9b8aa8ca94ea4219ec1fcbd4f4cab4f0ea57c5c3e1d81590600090a35060019392505050565b7f0e44922e752e5aec2c0503d75bafd73ddc558f76127cf1484a1819fd3dfb6b91546000907f0e44922e752e5aec2c0503d75bafd73ddc558f76127cf1484a1819fd3dfb6b909073ffffffffffffffffffffffffffffffffffffffff163314801561055b57503315155b6105e7576040517f08c379a000000000000000000000000000000000000000000000000000000000815260206004820152603560248201527f507269736d3a3a61636365707450726f787941646d696e3a2063616c6c65722060448201527f6d7573742062652070656e64696e672061646d696e00000000000000000000006064820152608401610469565b805460018201805473ffffffffffffffffffffffffffffffffffffffff8082167fffffffffffffffffffffffff000000000000000000000000000000000000000080861682178755909216909255604051919092169190819083907ff9ffabca9c8276e99321725bcb43fb076a6c66a54b7f21c4e8146d8519b417dc90600090a3600183015460405173ffffffffffffffffffffffffffffffffffffffff918216918316907fca4f2f25d0898edd99413412fb94012f9e54ec8142f9b093e7720646a95b16a990600090a36001935050505090565b7f0e44922e752e5aec2c0503d75bafd73ddc558f76127cf1484a1819fd3dfb6b93546000907f0e44922e752e5aec2c0503d75bafd73ddc558f76127cf1484a1819fd3dfb6b909073ffffffffffffffffffffffffffffffffffffffff16331480156107405750600381015473ffffffffffffffffffffffffffffffffffffffff1615155b6107cc576040517f08c379a000000000000000000000000000000000000000000000000000000000815260206004820152603c60248201527f507269736d3a3a61636365707450726f7879496d703a2063616c6c6572206d7560448201527f73742062652070656e64696e6720696d706c656d656e746174696f6e000000006064820152608401610469565b60028101805460038301805473ffffffffffffffffffffffffffffffffffffffff8082167fffffffffffffffffffffffff00000000000000000000000000000000000000008086168217909655949091168083559216929174010000000000000000000000000000000000000000900460ff1690601461084b83610a9f565b825460ff9182166101009390930a928302919092021990911617905550600283015460405173ffffffffffffffffffffffffffffffffffffffff918216918416907fd604de94d45953f9138079ec1b82d533cb2160c906d1076d1f7ed54befbca97a90600090a3600383015460405173ffffffffffffffffffffffffffffffffffffffff918216918316907fe945ccee5d701fc83f9b8aa8ca94ea4219ec1fcbd4f4cab4f0ea57c5c3e1d81590600090a36001935050505090565b6000807f0e44922e752e5aec2c0503d75bafd73ddc558f76127cf1484a1819fd3dfb6b90805490915073ffffffffffffffffffffffffffffffffffffffff1633146109d3576040517f08c379a000000000000000000000000000000000000000000000000000000000815260206004820152603160248201527f507269736d3a3a73657450656e64696e6750726f787941646d696e3a2063616c60448201527f6c6572206d7573742062652061646d696e0000000000000000000000000000006064820152608401610469565b60018101805473ffffffffffffffffffffffffffffffffffffffff8581167fffffffffffffffffffffffff0000000000000000000000000000000000000000831681179093556040519116919082907fca4f2f25d0898edd99413412fb94012f9e54ec8142f9b093e7720646a95b16a990600090a35060019392505050565b600060208284031215610a6457600080fd5b813573ffffffffffffffffffffffffffffffffffffffff81168114610a8857600080fd5b9392505050565b8183823760009101908152919050565b600060ff821660ff811415610add577f4e487b7100000000000000000000000000000000000000000000000000000000600052601160045260246000fd5b6001019291505056fea26469706673582212206584d5139cecbadcd53cedf9757c7322dfefebb0cec8ad08adfbac705b77534764736f6c63430008060033",
  "deployedBytecode": "0x60806040526004361061009a5760003560e01c80633e47158c1161006957806394d8fbd01161004e57806394d8fbd0146102565780639c2562db1461026b578063ec10bbd5146102b5576100a9565b80633e47158c146101f75780636405901614610241576100a9565b80630758e714146100b15780630c870f91146100e657806315596a201461015157806325f86cbb146101ad576100a9565b366100a9576100a76102d5565b005b6100a76102d5565b3480156100bd57600080fd5b506100d16100cc366004610a52565b6103a0565b60405190151581526020015b60405180910390f35b3480156100f257600080fd5b507f0e44922e752e5aec2c0503d75bafd73ddc558f76127cf1484a1819fd3dfb6b925473ffffffffffffffffffffffffffffffffffffffff165b60405173ffffffffffffffffffffffffffffffffffffffff90911681526020016100dd565b34801561015d57600080fd5b507f0e44922e752e5aec2c0503d75bafd73ddc558f76127cf1484a1819fd3dfb6b935474010000000000000000000000000000000000000000900460ff1660405160ff90911681526020016100dd565b3480156101b957600080fd5b507f0e44922e752e5aec2c0503d75bafd73ddc558f76127cf1484a1819fd3dfb6b915473ffffffffffffffffffffffffffffffffffffffff1661012c565b34801561020357600080fd5b507f0e44922e752e5aec2c0503d75bafd73ddc558f76127cf1484a1819fd3dfb6b905473ffffffffffffffffffffffffffffffffffffffff1661012c565b34801561024d57600080fd5b506100d16104f1565b34801561026257600080fd5b506100d16106bc565b34801561027757600080fd5b507f0e44922e752e5aec2c0503d75bafd73ddc558f76127cf1484a1819fd3dfb6b935473ffffffffffffffffffffffffffffffffffffffff1661012c565b3480156102c157600080fd5b506100d16102d0366004610a52565b610906565b7f0e44922e752e5aec2c0503d75bafd73ddc558f76127cf1484a1819fd3dfb6b92546040517f0e44922e752e5aec2c0503d75bafd73ddc558f76127cf1484a1819fd3dfb6b909160009173ffffffffffffffffffffffffffffffffffffffff909116906103459083903690610a8f565b600060405180830381855af49150503d8060008114610380576040519150601f19603f3d011682016040523d82523d6000602084013e610385565b606091505b505090506040513d6000823e81801561039c573d82f35b3d82fd5b6000807f0e44922e752e5aec2c0503d75bafd73ddc558f76127cf1484a1819fd3dfb6b90805490915073ffffffffffffffffffffffffffffffffffffffff163314610472576040517f08c379a000000000000000000000000000000000000000000000000000000000815260206004820152602f60248201527f507269736d3a3a73657450656e64696e6750726f7879496d703a2063616c6c6560448201527f72206d7573742062652061646d696e000000000000000000000000000000000060648201526084015b60405180910390fd5b60038101805473ffffffffffffffffffffffffffffffffffffffff8581167fffffffffffffffffffffffff0000000000000000000000000000000000000000831681179093556040519116919082907fe945ccee5d701fc83f9b8aa8ca94ea4219ec1fcbd4f4cab4f0ea57c5c3e1d81590600090a35060019392505050565b7f0e44922e752e5aec2c0503d75bafd73ddc558f76127cf1484a1819fd3dfb6b91546000907f0e44922e752e5aec2c0503d75bafd73ddc558f76127cf1484a1819fd3dfb6b909073ffffffffffffffffffffffffffffffffffffffff163314801561055b57503315155b6105e7576040517f08c379a000000000000000000000000000000000000000000000000000000000815260206004820152603560248201527f507269736d3a3a61636365707450726f787941646d696e3a2063616c6c65722060448201527f6d7573742062652070656e64696e672061646d696e00000000000000000000006064820152608401610469565b805460018201805473ffffffffffffffffffffffffffffffffffffffff8082167fffffffffffffffffffffffff000000000000000000000000000000000000000080861682178755909216909255604051919092169190819083907ff9ffabca9c8276e99321725bcb43fb076a6c66a54b7f21c4e8146d8519b417dc90600090a3600183015460405173ffffffffffffffffffffffffffffffffffffffff918216918316907fca4f2f25d0898edd99413412fb94012f9e54ec8142f9b093e7720646a95b16a990600090a36001935050505090565b7f0e44922e752e5aec2c0503d75bafd73ddc558f76127cf1484a1819fd3dfb6b93546000907f0e44922e752e5aec2c0503d75bafd73ddc558f76127cf1484a1819fd3dfb6b909073ffffffffffffffffffffffffffffffffffffffff16331480156107405750600381015473ffffffffffffffffffffffffffffffffffffffff1615155b6107cc576040517f08c379a000000000000000000000000000000000000000000000000000000000815260206004820152603c60248201527f507269736d3a3a61636365707450726f7879496d703a2063616c6c6572206d7560448201527f73742062652070656e64696e6720696d706c656d656e746174696f6e000000006064820152608401610469565b60028101805460038301805473ffffffffffffffffffffffffffffffffffffffff8082167fffffffffffffffffffffffff00000000000000000000000000000000000000008086168217909655949091168083559216929174010000000000000000000000000000000000000000900460ff1690601461084b83610a9f565b825460ff9182166101009390930a928302919092021990911617905550600283015460405173ffffffffffffffffffffffffffffffffffffffff918216918416907fd604de94d45953f9138079ec1b82d533cb2160c906d1076d1f7ed54befbca97a90600090a3600383015460405173ffffffffffffffffffffffffffffffffffffffff918216918316907fe945ccee5d701fc83f9b8aa8ca94ea4219ec1fcbd4f4cab4f0ea57c5c3e1d81590600090a36001935050505090565b6000807f0e44922e752e5aec2c0503d75bafd73ddc558f76127cf1484a1819fd3dfb6b90805490915073ffffffffffffffffffffffffffffffffffffffff1633146109d3576040517f08c379a000000000000000000000000000000000000000000000000000000000815260206004820152603160248201527f507269736d3a3a73657450656e64696e6750726f787941646d696e3a2063616c60448201527f6c6572206d7573742062652061646d696e0000000000000000000000000000006064820152608401610469565b60018101805473ffffffffffffffffffffffffffffffffffffffff8581167fffffffffffffffffffffffff0000000000000000000000000000000000000000831681179093556040519116919082907fca4f2f25d0898edd99413412fb94012f9e54ec8142f9b093e7720646a95b16a990600090a35060019392505050565b600060208284031215610a6457600080fd5b813573ffffffffffffffffffffffffffffffffffffffff81168114610a8857600080fd5b9392505050565b8183823760009101908152919050565b600060ff821660ff811415610add577f4e487b7100000000000000000000000000000000000000000000000000000000600052601160045260246000fd5b6001019291505056fea26469706673582212206584d5139cecbadcd53cedf9757c7322dfefebb0cec8ad08adfbac705b77534764736f6c63430008060033",
  "devdoc": {
    "details": "Storage for voting power is at this address, while execution is delegated to the prism proxy implementation contract All contracts that use voting power should reference this contract.",
    "kind": "dev",
    "methods": {
      "acceptProxyAdmin()": {
        "details": "Admin function for pending admin to accept role and update admin",
        "returns": {
          "_0": "boolean indicating success of operation"
        }
      },
      "acceptProxyImplementation()": {
        "details": "Admin function for new implementation to accept it's role as implementation",
        "returns": {
          "_0": "boolean indicating success of operation"
        }
      },
      "constructor": {
        "details": "Sets initial proxy admin to `msg.sender`"
      },
      "pendingProxyAdmin()": {
        "returns": {
          "_0": "admin address"
        }
      },
      "pendingProxyImplementation()": {
        "returns": {
          "_0": "pending implementation address"
        }
      },
      "proxyAdmin()": {
        "returns": {
          "_0": "admin address"
        }
      },
      "proxyImplementation()": {
        "returns": {
          "_0": "implementation address"
        }
      },
      "proxyImplementationVersion()": {
        "returns": {
          "_0": "version number"
        }
      },
      "setPendingProxyAdmin(address)": {
        "details": "Admin function to begin change of admin. The newPendingAdmin must call `acceptAdmin` to finalize the transfer.",
        "params": {
          "newPendingAdmin": "New pending admin."
        },
        "returns": {
          "_0": "boolean indicating success of operation"
        }
      },
      "setPendingProxyImplementation(address)": {
        "details": "Admin function for proposing new implementation contract",
        "returns": {
          "_0": "boolean indicating success of operation"
        }
      }
    },
    "title": "VotingPowerPrism",
    "version": 1
  },
  "userdoc": {
    "events": {
      "NewAdmin(address,address)": {
        "notice": "Emitted when pendingAdmin is accepted, which means admin is updated"
      },
      "NewImplementation(address,address)": {
        "notice": "Emitted when pendingImplementation is accepted, which means implementation is updated"
      },
      "NewPendingAdmin(address,address)": {
        "notice": "Emitted when pendingAdmin is changed"
      },
      "NewPendingImplementation(address,address)": {
        "notice": "Emitted when pendingImplementation is changed"
      }
    },
    "kind": "user",
    "methods": {
      "acceptProxyAdmin()": {
        "notice": "Accepts transfer of admin rights. msg.sender must be pendingAdmin"
      },
      "acceptProxyImplementation()": {
        "notice": "Accepts new implementation for prism. msg.sender must be pendingImplementation"
      },
      "constructor": {
        "notice": "Construct a new Voting Power Prism Proxy"
      },
      "pendingProxyAdmin()": {
        "notice": "Get pending admin for prism proxy"
      },
      "pendingProxyImplementation()": {
        "notice": "Address of pending implementation contract"
      },
      "proxyAdmin()": {
        "notice": "Get current admin for prism proxy"
      },
      "proxyImplementation()": {
        "notice": "Address of implementation contract"
      },
      "proxyImplementationVersion()": {
        "notice": "Current implementation version for proxy"
      },
      "setPendingProxyAdmin(address)": {
        "notice": "Begins transfer of admin rights. The newPendingAdmin must call `acceptAdmin` to finalize the transfer."
      },
      "setPendingProxyImplementation(address)": {
        "notice": "Create new pending implementation for prism. msg.sender must be admin"
      }
    },
    "version": 1
  },
  "storageLayout": {
    "storage": [],
    "types": null
  }
}